"Id","Transaction Type","Date","Amount","Type","Note","Name","Location","Primary Bank","Secondary Bank","Is Pending"
"0","NORMAL","2018-10-01","1000","INCOME_EARN","Work at my parent's chicken farm","Family","Mount Vernon, TX, US","","","false"
"1","NORMAL","2018-10-01","445.43","INCOME_EARN","Part-time grocery stocker","Brookshire's Grocery Company","Mount Vernon, TX, US","","","false"
"2","NORMAL","2018-10-01","-1120.53","SHOP","Desktop XPS, Monitor, Speaker","Dell Computer Corporation","Round Rock, TX, US","","","false"
"3","NORMAL","2018-10-01","-2.14","MEAL","Snacks","Northest Texas Community College","Mount Pleasant, TX, US","","","false"
"4","NORMAL","2018-10-01","-45.54","CAR_GAS","Commute to work and to school","Brookshire's Grocery Company","Mount Vernon, TX, US","","","false"
